FishstatJ commodity metadata for trade matrix,,
FAO. 2021. Fishery and Aquaculture Statistics. Global fish trade - By partner country. 2019 (FishstatJ). In: FAO Fisheries and Aquaculture Division [online]. Rome. Updated 2021. www.fao.org/fishery/statistics/software/fishstatj/en,,
FAO_CODE,NAME.EN,EBXID
034.1.5.1.50,"Flounder, fresh or chilled",1
034.1.5.2.45,"Alaska pollock, fresh or chilled",2
034.4.1.5.3.80,"Atka mackerel fillets, frozen",3
034.1.2.1.30,Trouts and chars live,4
034.1.2.1.90,"Fish live, nei",5
034.1.1.2.90,"Fish for culture incl. ova, fingerlings etc.",6
034.1.3.1.10,"Carps, fresh or chilled",7
034.1.3.2.20,"Tilapias, fresh or chilled",8
034.1.3.9.30,"Catfish, fresh or chilled",9
034.1.3.9.90,"Freshwater fish, nei, fresh or chilled",10
034.1.4.1.10,"Sturgeons, fresh or chilled",11
034.1.4.2.10,"Eels, fresh or chilled",12
034.1.4.2.11,"Elvers, fresh or chilled",13
034.1.4.3.10,"Whitefishes, fresh or chilled",14
034.1.4.3.20,"Atlantic and Danube salmons, fresh or chilled",15
034.1.4.3.30,"Pacific salmons, fresh or chilled",16
034.1.4.3.39,"Salmons, fresh or chilled, nei",17
034.1.4.3.50,"Trouts and chars, fresh or chilled",18
034.1.4.3.90,"Salmonoids, fresh or chilled, nei",19
034.1.5.1.11,"Atlantic halibut, fresh or chilled",20
034.1.5.1.12,"Pacific halibut, fresh or chilled",21
034.1.5.1.13,"Greenland halibut, fresh or chilled",22
034.1.5.1.19,"Halibuts, fresh or chilled, nei",23
034.1.5.1.39,"Plaices, fresh or chilled, nei",24
034.1.5.1.49,"Soles (Solea spp), fresh or chilled, nei",25
034.1.5.1.90,"Flatfish, fresh or chilled, nei",26
034.1.1.1,Fish for ornamental purposes,27
034.1.2.1,Miscellaneous fish live for human food,28
034.1.3.1,"Carps, barbels and other cyprinids, fresh or chilled",29
034.1.3.2,"Tilapias and other cichlids, fresh or chilled",30
034.1.3.9,"Miscellaneous freshwater fish, fresh or chilled",31
034.1.4.1,"Sturgeons, paddlefishes, fresh or chilled",32
034.1.4.2,"River eels, fresh or chilled",33
034.1.4.3,"Salmons, trouts, smelts, fresh or chilled",34
034.1.5.1,"Flounders, halibuts, soles, fresh or chilled",35
34,"Fish fresh (live or dead), chilled or frozen",36
34.1,"Fish, fresh (live or dead) or chilled (excluding fillets)",37
034.1.1,"Fish live, not for human consumption",38
034.1.2,"Fish live, for human consumption",39
034.1.3,"Freshwater fish, fresh or chilled",40
034.1.4,"Diadromous fish, fresh or chilled",41
034.1.5,"Marine fishes, fresh or chilled",42
034.1.5.2.11,"Atlantic cod, fresh or chilled",43
034.1.5.2.12,"Pacific cod, fresh or chilled",44
035.03.5.1.90,"Flatfish nei, smoked",45
034.1.5.2.30,"Haddock, fresh or chilled",46
034.1.5.2.40,"Saithe (=Pollock), fresh or chilled",47
034.1.5.2.53,"Whiting (Merlangius merlangus), fresh or chilled",48
034.1.5.2.90,"Gadiformes, fresh or chilled, nei",50
034.1.5.3.36,"Croakers, fresh or chilled",51
034.1.5.3.461,"Seabreams nei, fresh or chilled",52
034.1.5.4.41,"Atlantic redfishes, fresh or chilled",53
034.1.5.3.90,"Miscellaneous coastal fishes,nei, fresh or chilled",54
034.1.5.7.02,"Saury, fresh or chilled",55
034.1.5.7.70,"Jack and horse mackerels, fresh or chilled",56
035.03.4.3.50,"Trouts and chars, smoked",57
034.1.5.4.90,"Miscellaneous demersal fish,nei, fresh or chilled",58
034.1.5.5.11,"Atlantic herring, fresh or chilled",59
034.1.5.5.12,"Pacific herring, fresh or chilled",60
034.1.5.5.19,"Herrings, fresh or chilled, nei",61
034.1.5.5.40,"European sardine , fresh or chilled",62
034.1.5.5.29,"Pilchards(Sardinops spp.) and Sardinellas, fresh or chilled",63
034.1.5.5.50,"Brisling or sprats, fresh or chilled",64
034.1.5.5.60,"Anchovies (Engraulis spp), fresh or chilled",65
034.1.5.5.90,"Clupeoids, fresh or chilled, nei",66
034.1.5.2,"Cods, hakes, haddocks, fresh or chilled",67
034.1.5.3,"Miscellaneous coastal fish, fresh or chilled",68
034.1.5.4,"Miscellaneous demersal fish, fresh or chilled",69
034.1.5.5,"Herrings, sardines, anchovies, fresh or chilled",70
034.1.1.1.19,Ornamental fish nei,71
034.1.2.1.20,Eels and elvers live,72
034.1.5.2.19,"Cods, fresh or chilled, nei",73
034.1.5.7.75,"Amberjacks, fresh or chilled",74
034.4.4.1.4.2.39,"Salmon steaks, frozen",75
034.4.4.1.5.1.19,"Halibut steaks, frozen",76
034.4.4.1.5.1.90,"Flatfish steaks, frozen, nei",77
034.4.4.2.5.2.68,"Hake minced, frozen",78
034.2.5.7.62,"Atlantic mackerel, frozen",79
034.4.4.1.5.9.90,"Fish steaks, frozen, nei",80
034.4.4.2.5.9.91,"Fish minced (=surimi), frozen",81
35.02,"Fish, dried, salted or in brine",82
035.02.1,"Fish dried, whether or not salted, but not smoked",83
037.1.1.5.7.02,"Pacific sauries prepared or preserved, not minced",85
037.1.1.5.5.601,"Anchovies fillets, prepared or preserved",86
037.1.1.6.93,"Fish products (not minced), semi-preserved",87
035.02.1.5,"Marine fishes, dried, whether or not salted",88
034.1.5.2.70,"Ling, fresh or chilled",89
034.1.5.2.80,"Tusk, fresh or chilled",90
034.1.5.4.12,"Snoek, fresh or chilled",91
034.2.5.1.50,"Flounder, frozen",92
034.2.5.2.80,"Tusk, frozen",93
034.2.5.2.70,"Ling, frozen",94
034.2.5.7.08,"Pomfrets, ocean breams, frozen",95
034.2.5.6.10,"Bonito, frozen",96
034.2.5.4.12,"Snoek, frozen",97
034.2.9.1.21,"Cod roes, frozen",98
034.2.9.1.22,"Alaska pollock, roes, frozen",99
034.2.9.1.23,"Capelin roes, frozen",100
034.2.9.1.24,"Herring roes, frozen",101
034.2.9.1.26,"Salmon roes, frozen",102
034.3.1.5.4,"Miscellaneous demersal fish, fillets, fresh or chilled",103
034.3.1.5.4.90,"Miscellaneous demersal fish, fillets, fresh or chilled, nei,",104
034.3.1.4.2,"River eel fillets, fresh or chilled",105
034.3.1.4.2.10,"River eel fillets, fresh or chilled, nei",106
034.4.1.4.2,"River eel fillets, frozen",107
034.4.1.4.2.10,"River eel fillets, frozen, nei",108
034.4.1.4.3.391,"Salmon fillets, frozen",109
034.1.5.6.20,"Skipjack tuna, fresh or chilled",112
034.1.5.6.30,"Atlantic(Thunnus thynnus)and Pacific(Thunnus orientalis)bluefin tuna, fresh or chilled",113
034.1.5.6.40,"Albacore (=Longfin tuna), fresh or chilled",114
034.1.5.6.50,"Yellowfin tuna, fresh or chilled",115
034.1.5.6.60,"Bigeye tuna, fresh or chilled",116
034.1.5.6.80,"Swordfish, fresh or chilled",117
034.1.5.6.90,"Tunas, fresh or chilled, nei",118
034.1.5.4.13,"Hairtails, fresh or chilled",119
034.1.5.7.61,"Chub mackerel, fresh or chilled",120
034.1.5.7.69,"Mackerels, nei, fresh or chilled",121
034.1.5.8.70,"Sharks nei, fresh or chilled",122
034.1.5.8.90,"Sharks, rays, skates, fresh or chilled, nei",123
034.1.5.9.90,"Marine fish, fresh or chilled, nei",124
034.1.9.1.10,"Fish livers, fresh or chilled",125
034.1.9.1.20,"Fish roes, fresh or chilled",126
034.1.9.1.90,"Livers, roes, milt, fresh or chilled, nei",127
034.2.3.1.10,"Carps, frozen",128
034.2.3.9.30,"Catfish, frozen",129
034.4.4.1.3.9.30,"Catfish steaks, frozen",130
034.2.3.9.90,"Freshwater fish nei, frozen",131
034.2.4.2.10,"Eels, frozen",132
034.2.4.3.10,"Whitefishes, frozen",133
034.2.4.3.20,"Atlantic salmon and Danube salmon, frozen",134
034.2.4.3.39,"Salmons nei, frozen",136
034.1.5.6,"Tunas, bonitos, billfishes, fresh or chilled",137
034.1.5.7,"Miscellaneous pelagic fish, fresh or chilled",138
034.1.5.8,"Sharks, rays, chimaeras, fresh or chilled",139
034.1.5.9,"Miscellaneous marine fish, fresh or chilled",140
034.1.9.1,"Fish livers, roes, etc., fresh or chilled",141
034.2.3.1,"Carps, barbels and other cyprinids, frozen",142
034.2.3.9,"Miscellaneous freshwater fish, frozen",143
034.2.4.2,"River eels, frozen",144
034.2.4.3,"Salmons, trouts, smelts, frozen",145
034.1.9,"Miscellaneous fish products, fresh or chilled",146
34.2,"Fish, frozen (excluding fillets)",147
034.2.3,"Freshwater fish, frozen",148
034.2.4,"Diadromous fish, frozen",149
034.2.4.3.50,"Trouts and chars, frozen",150
034.2.4.3.60,"Smelts, frozen",151
034.2.4.3.90,"Salmonoids, frozen",152
034.2.5.1.11,"Atlantic halibut, frozen",153
034.2.5.1.12,"Pacific halibut, frozen",154
034.2.5.1.13,"Greenland halibut, frozen",155
034.2.5.1.19,"Halibuts nei, frozen",156
034.2.5.1.39,"Plaices, frozen, nei",157
034.2.5.1.49,"Soles (Solea spp), frozen, nei",158
034.2.5.1.90,"Flatfish nei, frozen",159
035.03.4.3.90,"Salmonoids nei, smoked",160
034.2.5.2.11,"Atlantic cod, frozen",161
034.2.5.2.12,"Pacific cod, frozen",162
034.2.5.2.19,"Cods nei, frozen",163
034.2.5.2.30,"Haddock, frozen",164
034.2.5.2.40,"Saithe (=Pollock), frozen",165
034.2.5.2.45,"Alaska pollock, frozen",166
034.2.5.2.53,"Whiting, frozen",167
034.2.5.2.90,"Gadiformes nei, frozen",169
034.2.5.3.22,"Seabass, frozen",170
034.2.5.3.24,"Snappers, frozen",171
034.2.5.3.36,"Croakers, frozen",172
034.2.5.3.46,"Seabreams, frozen",173
034.2.5.4.09,"Wolffishes (=Catfishes), frozen",174
034.2.5.4.11,"Cusk-eel (=kingklip), frozen",175
034.2.5.1,"Flounders, halibuts, soles, frozen",176
034.2.5.2,"Cods, hakes, haddocks, frozen",177
034.2.5.3,"Miscellaneous coastal fish, frozen",178
034.2.5,"Marine fishes, frozen",179
034.2.5.4.41,"Atlantic redfishes, frozen",180
034.2.5.3.74,"Puffers, frozen",181
034.2.5.3.90,"Miscellaneous coastal fish, nei, frozen",182
034.2.5.7.01,"Capelin, frozen",183
034.2.5.7.02,"Saury, frozen",184
034.2.5.7.03,"Bluefish, frozen",185
034.2.5.7.70,"Jack and horse mackerel, frozen",186
034.2.5.7.75,"Amberjacks, frozen",187
034.2.5.4.90,"Miscellaneous demersal fish, nei, frozen",188
034.2.5.5.11,"Atlantic herring, frozen",189
034.2.5.5.12,"Pacific herring, frozen",190
034.2.5.5.19,"Herrings nei, frozen",191
034.2.5.5.29,"Pilchards(Sardinops spp.) and Sardinellas, frozen",192
034.2.5.5.40,"European sardine, frozen",193
034.2.5.5.50,"Brisling or sprats, frozen",194
034.2.5.5.60,"Anchovies, frozen",195
034.2.5.5.90,"Clupeoids nei, frozen",196
034.2.5.6.29,"Skipjack tuna, frozen",197
034.2.5.6.30,"Atlantic(Thunnus thynnus)and Pacific(Thunnus orientalis)bluefin tuna, frozen",198
034.2.5.6.49,"Albacore (=Longfin tuna), frozen, nei",199
034.2.5.6.41,"Albacore (=Longfin tuna), gilled, gutted, frozen",200
034.2.5.6.42,"Albacore (=Longfin tuna), heads-off, etc., frozen",201
034.2.5.6.59,"Yellowfin tuna, frozen, nei",202
034.2.5.6.51,"Yellowfin tuna, gilled, gutted, frozen",203
034.2.5.6.52,"Yellowfin tuna, heads-off, etc., frozen",204
034.2.5.6.69,"Bigeye tuna, frozen, nei",205
034.2.5.6.71,"Marlins, frozen",206
034.2.5.6.80,"Swordfish, frozen",207
034.2.5.6.909,"Tunas nei, frozen",208
034.2.5.6.901,"Tunas, gilled, gutted, frozen, nei",209
034.2.5.6.902,"Tunas, heads-off, etc., frozen, nei",210
034.2.5.4,"Miscellaneous demersal fish, frozen",211
034.2.5.5,"Herrings, sardines, anchovies, frozen",212
034.2.5.6,"Tunas, bonitos, billfishes, frozen",213
034.2.5.4.13,"Hairtails, frozen",214
034.2.5.7.61,"Chub mackerel, frozen",215
034.2.5.7.69,"Mackerels nei, frozen",216
034.2.5.8.70,"Dogfish and other sharks nei (excl. Squalus acanthias, Scyliorhinus spp., Lamna nasus, Prionace glauca), frozen",217
034.2.5.8.80,"Rays and skates (Rajidae), frozen",218
034.2.5.8.90,"Sharks, rays, chimaeras nei, frozen",219
034.2.5.9.90,"Marine fish, frozen, nei",220
034.2.9.1.10,"Fish livers, frozen",221
034.2.9.1.29,"Fish roes, frozen, nei",222
034.2.9.1.90,"Livers, roes, milt, frozen",223
034.3.1.3.1.10,"Carp fillets, fresh or chilled",224
034.3.1.3.9.40,"Perch fillets, fresh or chilled",225
034.3.1.3.9.90,"Freshwater fish fillets, fresh or chilled, nei",226
034.3.1.5.1.31,"European plaice fillets, fresh or chilled",227
034.3.1.5.1.50,"Flounder fillets, fresh or chilled",228
034.3.1.5.1.45,"Common sole fillets, fresh or chilled",229
034.3.1.5.1.90,"Flatfish nei, fillets, fresh or chilled",230
034.3.1.5.2.11,"Atlantic cod, fillets, fresh or chilled",231
034.3.1.5.2.12,"Pacific cod fillets, fresh or chilled",232
034.3.1.5.2.19,"Cods nei, fillets, fresh or chilled",233
034.3.1.5.2.30,"Haddock fillets, fresh or chilled",234
034.3.1.5.2.40,"Saithe (=Pollock) fillets, fresh or chilled",235
034.3.1.5.2.53,"Whiting fillets, fresh or chilled",236
034.3.1.5.2.90,"Gadiformes fillets, fresh or chilled, nei",238
034.2.5.7,"Miscellaneous pelagic fish, frozen",239
034.2.5.8,"Sharks, rays, chimaeras, frozen",240
034.2.5.9,"Miscellaneous marine fish, frozen",241
034.2.9.1,"Fish livers, roes, milt, frozen",242
034.3.1.3.1,"Carps, barbels and other cyprinids fillets, fresh or chilled",243
034.3.1.3.9,"Miscellaneous freshwater fish fillets, fresh or chilled",244
034.3.1.5.1,"Flounders, halibuts, soles fillets, fresh or chilled",245
034.3.1.5.2,"Cods, hakes, haddocks, etc. fillets, fresh or chilled",246
034.2.9,"Miscellaneous fish products, frozen",247
34.3,"Fish fillets and meat, fresh or chilled",248
034.3.1.3,"Freshwater fish fillets, fresh or chilled",249
034.3.1.5,"Marine fish fillets, fresh or chilled",250
034.3.1.5.4.49,"Redfish fillets, fresh or chilled",251
034.3.1.5.3.90,"Miscellaneous coastal fish, fillets, fresh or chilled, nei",252
034.3.1.5.5.11,"Atlantic herring fillets, fresh or chilled",253
034.3.1.5.5.12,"Pacific herring fillets, fresh or chilled",254
034.3.1.5.5.19,"Herring nei, fillets, fresh or chilled",255
034.3.1.5.5.90,"Clupeoids, fillets, fresh or chilled, nei",256
034.3.1.5.6.90,"Tuna loins and fillets, fresh or chilled",257
034.3.1.5.8.70,"Dogfish (Squalidae) and other sharks, fillets, fresh or chilled",258
034.4.1.3.9.30,"Catfish fillets, frozen",260
034.4.1.3.9.90,"Freshwater fish fillets, nei, frozen",261
034.4.1.4.3.90,"Salmonoids fillets, frozen, nei",263
034.4.1.5.1.13,"Greenland halibut fillets, frozen",264
034.4.1.5.1.19,"Halibut nei, fillets, frozen",265
034.4.1.5.1.31,"European plaice fillets, frozen",266
034.4.1.5.1.50,"Flounder fillets, frozen",267
034.4.1.5.1.45,"Common sole fillets, frozen",268
034.4.1.5.1.70,"Turbot fillets, frozen",269
034.4.1.5.1.90,"Flatfish nei, fillets, frozen",270
034.4.1.5.2.11,"Atlantic cod fillets, frozen",271
034.4.1.5.2.12,"Pacific cod fillets, frozen",272
034.4.1.5.2.19,"Cod nei, fillets, frozen",273
034.4.1.5.2.25,"Ling fillets, frozen",274
034.4.1.5.2.30,"Haddock fillets, frozen",275
034.3.1.5.3,"Miscellaneous coastal fish, fillets, fresh or chilled",276
034.3.1.5.5,"Herrings, sardines, anchovies, etc. fillets, fresh or chilled",277
034.3.1.5.6,"Tunas, bonitos, billfishes fillets, fresh or chilled",278
034.3.1.5.8,"Sharks, rays, chimaeras, etc. fillets, fresh or chilled",279
034.3.1.5.9.90,"Miscellaneous marine fish fillets, fresh or chilled, nei",280
034.4.1.3.9,"Miscellaneous freshwater fish fillets, frozen",281
034.4.1.4.3,"Salmons, trouts, smelts, etc. fillets, frozen",282
034.4.1.5.1,"Flounders, halibuts, soles, etc. fillets, frozen",283
034.4.1.5.2,"Cods, hakes, haddocks, etc. fillets, frozen",284
34.4,"Fish fillets and meat, frozen",285
034.4.1,"Fish fillets, frozen (excluding blocks and sticks)",286
034.4.1.3,"Freshwater fish fillets, frozen",287
034.4.1.4,"Diadromous fish fillets, frozen",288
034.4.1.5,"Marine fish fillets, frozen",289
034.4.1.5.2.40,"Saithe (=Pollock) fillets, frozen",290
034.4.1.5.2.45,"Alaska pollock fillets, frozen",291
034.4.1.5.2.53,"Whiting fillets, frozen",292
034.4.1.5.2.90,"Gadiformes fillets, frozen, nei",294
034.4.1.5.4.09,"Wolffish (=Catfish) fillets, frozen",295
034.4.1.5.4.41,"Atlantic redfishes, fillets, frozen",296
034.4.1.5.3.90,"Miscellaneous coastal fishes fillets, frozen,  nei",297
034.4.1.5.7.75,"Amberjack fillets, frozen",298
034.4.1.5.4.90,"Miscellaneous demersal fish, fillets, frozen, nei",299
034.4.1.5.5.11,"Atlantic herring fillets, frozen",300
034.4.1.5.5.12,"Pacific herring fillets, frozen",301
034.4.1.5.5.19,"Herring nei, fillets, frozen",302
034.4.1.5.5.20,"Pilchard fillets, frozen",303
034.4.1.5.5.90,"Clupeoids nei, fillets, frozen",304
034.4.1.5.6.90,"Tuna loins and fillets, frozen",305
034.4.1.5.7.69,"Mackerel fillets, frozen",306
034.4.1.5.8.70,"Shark fillets nei, frozen",307
034.4.1.5.9.90,"Marine fish fillets, frozen, nei",308
034.4.2.3.9.90,"Freshwater fish fillets in blocks, frozen nei",309
034.4.2.4.3.90,"Salmonoids fillets in blocks, frozen",310
034.4.2.5.1.90,"Flatfish fillets in blocks, frozen, nei",311
034.4.1.5.3,"Miscellaneous coastal fish, fillets, frozen",312
034.4.1.5.4,"Miscellaneous demersal fish, fillets, frozen",313
034.4.1.5.5,"Herrings, sardines, anchovies, etc. fillets, frozen",314
034.4.1.5.6,"Tunas, bonitos, billfishes, etc. fillets, frozen",315
034.4.1.5.7,"Miscellaneous pelagic fish, etc. fillets, frozen",316
034.4.1.5.8,"Sharks, rays, chimaeras, etc. fillets, frozen",317
034.4.1.5.9,"Miscellaneous marine fish fillets, frozen",318
034.4.2.3.9,"Miscellaneous freshwater fish fillets in blocks, frozen",319
034.4.2.4.3,"Salmons, trouts, smelts, etc. fillets in blocks, frozen",320
034.4.2.5.1,"Flounders, halibuts, soles, etc. fillets in blocks, frozen",321
034.4.2,"Fish fillets in blocks, frozen",322
034.4.2.3,"Freshwater fish fillets in blocks, frozen",323
034.4.2.4,"Diadromous fish fillets in blocks, frozen",324
034.4.2.5,"Marine fish fillets in blocks, frozen",325
034.4.2.5.2.11,"Atlantic cod, fillets in blocks, frozen",326
034.4.2.5.2.12,"Pacific cod fillets in blocks, frozen",327
034.4.2.5.2.19,"Cod fillets in blocks, frozen, nei",328
034.4.2.5.2.30,"Haddock fillets in blocks, frozen",329
034.4.2.5.2.40,"Saithe (=Pollock) fillets in blocks, frozen",330
034.4.2.5.2.45,"Alaska pollock fillets in blocks, frozen",331
034.4.2.5.2.60,"Hake fillets in blocks, frozen",332
034.4.2.5.4.41,"Atlantic redfishes fillets in blocks, frozen",333
034.4.2.5.9.90,"Marine fish fillets in blocks, nei, frozen",334
034.4.3.5.1.90,"Flatfish portions and sticks, frozen",335
034.4.3.5.2.19,"Cod portions and sticks, frozen",336
034.4.3.5.2.30,"Haddock portions and sticks, frozen",337
034.4.3.5.2.45,"Alaska pollock, portions and sticks, frozen",338
034.4.3.5.2.60,"Hake portions and sticks, frozen",339
034.4.3.5.9.90,"Fish portions and sticks, nei, frozen",340
034.1.4.4,"Shads, fresh or chilled",341
034.1.4.4.10,"Shads, nei, fresh or chilled",342
034.4.2.5.2,"Cods, hakes, haddocks, etc. fillets in blocks, frozen",343
034.4.2.5.3,"Miscellaneous coastal fish, fillets in blocks, frozen",344
034.4.2.5.9,"Miscellaneous marine fish fillets in blocks, frozen",345
034.4.3.5.1,"Flounders, halibuts, soles, etc. portions and sticks, frozen",346
034.4.3.5.2,"Cods, hakes, haddocks, etc. portions and sticks, frozen",347
034.4.3.5.9,"Miscellaneous marine fish, portions and sticks, frozen",348
037.2.2.1.9.95,"Molluscs and other aq. invertebrates, prep. or pres., nei",349
034.4.3,"Fish portions and sticks, frozen",351
034.4.3.5,"Marine fish portions and sticks, frozen",352
035.02.3.5.3,"Miscellaneous coastal fish, fillets, dried, salted or in brine",354
035.02.3.5.3.90,"Miscellaneous coastal fish nei, fillets, dried, salted or in brine",356
035.02.1.5.2.12,"Cod, salted and dried (klipfish)",357
411.12.4.4.10,Shad oil,358
035.02.2.5.3.49,"Mullet, salted",362
035.02.3.9.1.21,"Cod roes, salted or sugar salted",363
035.02.3.9.1.22,"Alaska pollock, roes, pickled",364
035.02.3.9.1.24,"Herring roes, dried",365
035.02.3.9.1.25,"Herring roes, cured",366
035.02.2.5.1.90,"Flatfish, salted or in brine, nei",368
035.02.2.5.2.11,"Atlantic cod, salted or in brine",369
035.02.2.4.5.90,"Miscellaneous diadromous fish, salted or in brine, nei",370
035.02.3.5.2.60,"Hakes, fillets, dried, salted or in brine",372
035.02.3.9.1.26,"Salmon roes, cured",373
035.02.3.9.1.27,"Lumpfish roes, salted",374
036.0.1.4.3.31,"Norway lobsters (Nephrops spp.), whole, frozen",375
035.02.3.5.8.90,"Sharks, rays, etc., fillets, dried, salted or in brine, nei",378
035.02.1.5.2.90,"Gadiformes nei, dried, unsalted",379
035.01.1,Fishmeal fit for human consumption,382
035.02.1.5.2,"Cods, hakes, haddocks, etc., dried, whether or not salted",384
035.02.3.3.9,"Miscellaneous freshwater fish, fillets, dried, salted or in brine",386
035.02.3.4.3,"Salmons, trouts, smelts, etc., fillets, dried, salted or in brine",387
035.02.3.4.5,"Miscellaneous diadromous fish, fillets, dried, salted or in brine",388
035.02.3.5.1,"Flounders, halibuts, soles, etc., fillets, dried, salted or in brine",389
035.02.3.5.2,"Cods, hakes, haddocks, etc., fillets, dried, salted or in brine",390
035.02.3.5.4,"Miscellaneous demersal fish, fillets, dried, salted or in brine",391
035.02.3.5.5,"Herrings, sardines, anchovies, etc., fillets, dried, salted or in brine",392
035.01.1.90,"Fishmeal fit for human consumption, nei",393
035.02.1.5.2.11,"Cod, dried, unsalted (stockfish)",394
035.02.1.5.2.19,"Cods nei, dried,  whether or not salted",395
035.02.1.5.2.60,"Hakes, dried, unsalted",396
035.02.1.5.4.90,"Groundfish, dried, unsalted, nei",397
035.02.3.9.2.31,"Shark fins, dried, unsalted",399
035.02.3.3.9.90,"Freshwater fish nei, fillets, dried, salted, or in brine",400
035.02.2.4.3.39,"Salmons, salted or in brine",401
035.02.2.4.3.391,"Salmon sides, salted or in brine",402
035.02.1.4.3.50,"Trouts, dried, salted",403
035.02.3.5.5.90,"Clupeoids nei, fillets, dried, salted or in brine",405
035.02.3.5.1.13,"Greenland halibut fillets, dried, salted or in brine",406
035.03.3,"Freshwater fish, smoked",407
035.02.3.5.2.11,"Cod nei fillets, dried, salted or in brine",408
035.03.3.9,"Miscellaneous freshwater fish, smoked",409
035.03.3.9.90,"Miscellaneous freshwater fish, smoked",410
035.02.1.5.2.95,"Gadiformes nei, dried and salted",411
035.02.2.5.2.90,"Gadiformes, salted or in brine, nei",412
035.02.3.5.4.90,"Miscellaneous demersal fish nei, fillets, dried, salted or in brine",414
035.02.1.5.3.90,"Miscellaneous coastal fish, nei, dried, unsalted",415
035.02.3.5.5.191,"Herring fillets, dried, salted or in brine",416
035.03.5.4.12,"Snoeks, smoked",418
035.02.3.9,"Miscellaneous fish products, dried, salted or in brine",420
35.03,Fish smoked,421
035.03.4,"Diadromous fish, smoked",422
035.03.5,"Marine fishes, smoked",423
035.03.9,"Miscellaneous fish products, smoked",424
035.02.3.5.6,"Tunas, bonitos, billfishes, etc., fillets, dried, salted or in brine",425
035.02.3.5.7,"Miscellaneous pelagic fish, fillets, dried, salted or in brine",426
035.02.3.5.8,"Sharks, rays, chimaeras, etc., fillets, dried, salted or in brine",427
035.02.3.5.9,"Miscellaneous marine fish, fillets, dried, salted or in brine",428
035.02.3.9.1,"Fish livers, roes, milt etc., dried, salted or in brine",429
035.03.4.2,"River eels, smoked",430
035.03.4.3,"Salmons, trouts, smelts, etc., smoked",431
035.03.4.5,"Miscellaneous diadromous fish, smoked",432
035.03.5.1,"Flounders, halibuts, soles, etc., smoked",433
035.03.5.2,"Cods, hakes, haddocks, etc., smoked",434
035.03.5.5,"Herrings, sardines, anchovies, etc., smoked",435
035.03.5.6,"Tunas, bonitos, billfishes, etc., smoked",436
035.03.5.7,"Miscellaneous pelagic fish, smoked",437
035.03.5.9,"Miscellaneous marine fish, smoked",438
035.03.9.1,"Fish livers, roes, etc., smoked",439
035.02.2.5.6.90,"Tunas nei, salted or in brine",440
035.02.2.5.7.69,"Mackerels nei, salted or in brine",442
035.02.3.5.8.70,"Sharks, fillets, dried, salted or in brine",443
035.02.2.5.4.91,"Groundfish nei, salted or in brine",444
035.02.2.6.90,"Fish nei, salted or in brine",445
035.02.3.5.9.99,"Marine fish, fillets, dried, salted or in brine, nei",448
035.02.3.9.1.10,"Fish livers, dried, salted or in brine",449
035.02.3.9.1.29,"Fish roes, dried, salted or in brine, nei",450
035.02.3.9.2.32,"Shark fins, smoked, dried, whether or not salted, etc.",451
035.02.3.9.1.90,"Livers, roes, milt, dried, salted or in brine, nei",452
035.03.4.2.10,"Eels, smoked",453
035.03.4.3.39,"Salmons, smoked",454
035.03.4.5.90,"Diadromous fish, nei, smoked",455
035.03.5.1.11,"Atlantic halibut, smoked",456
035.03.5.1.13,"Greenland halibut, smoked",457
035.03.5.2.19,"Cods, smoked",458
035.03.5.2.30,"Haddock, smoked",459
035.03.5.5.11,"Atlantic herring, smoked",460
035.03.5.5.19,"Herrings nei, smoked",461
035.03.5.5.50,"Sardines and sprats, smoked",462
035.03.5.6.20,"Skipjack tuna, smoked",463
035.03.5.6.90,"Tunas nei, smoked",464
035.03.5.7.69,"Mackerels, smoked",465
035.03.5.9.90,"Marine fish fillets, smoked",466
035.03.5.9.95,"Marine fish nei, smoked",467
035.03.9.1.90,"Livers and roes, smoked",468
36,"Crustaceans, molluscs, aq. inver, live,fresh,chilled,frozen, salted, in brine or dried, smoked",469
036.0.1,"Crustaceans, live, fresh, chilled, frozen, salted, in brine or dried, smoked",470
036.0.1.1,"Crustaceans live, not for human consumption",471
036.0.1.3,"Crustaceans live, fresh, chilled or boiled in water",473
036.0.1.1.1,"Miscellaneous crustaceans live, not for human consumption",474
036.0.1.3.1,"Freshwater crustaceans, live, fresh or chilled",476
036.0.1.3.2,"Crabs, live, fresh or chilled",477
036.0.1.3.3,"Lobsters, spiny-rock lobsters, etc., live, fresh or chilled",478
036.0.1.3.4,"Squat-lobsters, etc., fresh or chilled",479
036.0.1.3.5,"Shrimps, prawns, etc., live, fresh or chilled",480
036.0.1.3.9,"Miscellaneous marine crustaceans, live, fresh or chilled",481
036.0.1.3.1.10,"Crayfish (freshwater), live, fresh or chilled",485
036.0.1.3.1.90,"Freshwater crustaceans nei, live, fresh or chilled",486
036.0.1.3.2.90,"Crabs, peeled or not, live, fresh or chilled, nei",487
036.0.1.3.3.11,"Spiny lobsters (Panulirus spp.), whole, fresh or chilled",488
036.0.1.3.3.12,"Spiny lobsters (Panulirus spp.), meat or tails, fresh or chilled",489
036.0.1.3.3.21,"Rock lobsters (Jasus spp.), whole, fresh or chilled",490
036.0.1.3.3.22,"Rock lobsters (Jasus spp.), meat or tails, fresh or chilled",491
036.0.1.3.3.91,"Lobsters nei, whole, fresh or chilled",492
036.0.1.3.3.31,"Norway lobsters (Nephrops spp.), whole, fresh or chilled",493
036.0.1.3.5.20,"Cold-water shrimps and prawns Pandalus spp, in shell or not, live, fresh or chilled",494
036.0.1.3.5.30,"Shrimps Crangon crangon, in shell or not, live, fresh or chilled",495
036.0.1.3.5.99,"Shrimps and prawns, live, fresh or chilled, nei",496
036.0.1.3.5.91,"Shrimp tails, fresh or chilled",497
036.0.1.3.9.90,"Crustaceans, live, fresh, chilled or boiled in water, nei",498
036.0.1.4,"Crustaceans, frozen",499
036.0.1.4.2,"Crabs and crab meat, frozen",500
036.0.1.4.3,"Lobsters and lobster meat, frozen",501
036.0.1.4.5,"Shrimps, prawns etc., frozen",502
036.0.1.4.2.19,"King crab, nei, frozen",503
036.0.1.4.2.11,"King crab meat, frozen",504
036.0.1.4.2.29,"Tanner crab, nei, frozen",505
